Sheet: Sheet1
C2: R440 | D2: XPS | F2: Relative Performance (XPS) | K2: R440 | L2: XPS | N2: Relative Performance (XPS)
B3: LargestPrime | C3: 3264 | D3: 2652 | E3: ns | F3: of:=[.D3]/[.C3] -> 0.8125 | J3: AggregationQuery NVNS 16 keys | K3: 1336 | L3: 547 | M3: ms | N3: of:=[.L3]/[.K3] -> 0.409431137724551
B4: Euclid – Division | C4: 7186 | D4: 5452 | F4: of:=[.D4]/[.C4] -> 0.758697467297523 | J4: AggregationQuery NVNS 256 keys | K4: 1354 | L4: 539 | N4: of:=[.L4]/[.K4] -> 0.39807976366322
B5: Euclid – Subtraction | C5: 15488 | D5: 12400 | F5: of:=[.D5]/[.C5] -> 0.800619834710744 | J5: AggregationQuery NVNS 4096 keys | K5: 1568 | L5: 715 | N5: of:=[.L5]/[.K5] -> 0.455994897959184
B6: N-Factorial | C6: 734187 | D6: 597706 | F6: of:=[.D6]/[.C6] -> 0.814105943036311 | J6: AggregationQuery NVNS 65536 keys | K6: 3113 | L6: 1267 | N6: of:=[.L6]/[.K6] -> 0.407002891101831
B7: Fib_N | C7: 257700 | D7: 209551 | F7: of:=[.D7]/[.C7] -> 0.813158711680248
J8: AggregationQuery NVS 16 keys | K8: 1583 | L8: 740 | M8: ms | N8: of:=[.L8]/[.K8] -> 0.467466835123184
B9: Filter NVNS – col 1 | C9: 46.4 | D9: 44.1 | E9: ms | F9: of:=[.D9]/[.C9] -> 0.950431034482759 | J9: AggregationQuery NVS 256 keys | K9: 1583 | L9: 744 | N9: of:=[.L9]/[.K9] -> 0.469993682880606
B10: Filter NVNS – col 2 | C10: 52.2 | D10: 51.1 | F10: of:=[.D10]/[.C10] -> 0.978927203065134 | J10: AggregationQuery NVS 4096 keys | K10: 1901 | L10: 1179 | N10: of:=[.L10]/[.K10] -> 0.620199894792215
B11: Filter NVNS – col 3 | C11: 46.9 | D11: 47.3 | F11: of:=[.D11]/[.C11] -> 1.00852878464819 | J11: AggregationQuery NVS 65536 keys | K11: 3515 | L11: 1638 | N11: of:=[.L11]/[.K11] -> 0.466002844950213
B13: Filter NVS – col 1 | C13: 39.7 | D13: 73.8 | E13: ms | F13: of:=[.D13]/[.C13] -> 1.85894206549118 | J13: AggregationQuery VNS 16 keys | K13: 1595 | L13: 760 | M13: ms | N13: of:=[.L13]/[.K13] -> 0.476489028213166
B14: Filter NVS – col 2 | C14: 39.6 | D14: 73.8 | F14: of:=[.D14]/[.C14] -> 1.86363636363636 | J14: AggregationQuery VNS 256 keys | K14: 1569 | L14: 760 | N14: of:=[.L14]/[.K14] -> 0.484384958572339
B15: Filter NVS – col 3 | C15: 39.6 | D15: 73.6 | F15: of:=[.D15]/[.C15] -> 1.85858585858586 | J15: AggregationQuery VNS 4096 keys | K15: 1688 | L15: 861 | N15: of:=[.L15]/[.K15] -> 0.510071090047393
J16: AggregationQuery VNS 65536 keys | K16: 3104 | L16: 1346 | N16: of:=[.L16]/[.K16] -> 0.433634020618557
B17: Filter VNS – col 1 | C17: 30.3 | D17: 25.6 | E17: ms | F17: of:=[.D17]/[.C17] -> 0.844884488448845
B18: Filter VNS – col 2 | C18: 55.1 | D18: 53.2 | F18: of:=[.D18]/[.C18] -> 0.96551724137931 | J18: AggregationQuery VS 16 keys | K18: 1689 | L18: 758 | M18: ms | N18: of:=[.L18]/[.K18] -> 0.448786264061575
B19: Filter VNS – col 3 | C19: 87.9 | D19: 90.1 | F19: of:=[.D19]/[.C19] -> 1.02502844141069 | J19: AggregationQuery VS 256 keys | K19: 1670 | L19: 751 | N19: of:=[.L19]/[.K19] -> 0.449700598802395
J20: AggregationQuery VS 4096 keys | K20: 1843 | L20: 836 | N20: of:=[.L20]/[.K20] -> 0.45360824742268
B21: Filter VS – col 1 | C21: 48.4 | D21: 42.4 | E21: ms | F21: of:=[.D21]/[.C21] -> 0.87603305785124 | J21: AggregationQuery VS 65536 keys | K21: 3192 | L21: 1317 | N21: of:=[.L21]/[.K21] -> 0.412593984962406
B22: Filter VS – col 2 | C22: 48.5 | D22: 40.8 | F22: of:=[.D22]/[.C22] -> 0.841237113402062
B23: Filter VS – col 3 | C23: 48.3 | D23: 41.8 | F23: of:=[.D23]/[.C23] -> 0.865424430641822