Sheet: Sheet1
B2: Becnhmark | C2: Execution | D2: Orig codgen time | E2: Orig Compilation Time | F2: Orig combined Time | G2: Orig End-to-End Time | H2: Orig Relative Time
B3: tpch_q1 | C3: non-vectorised | D3: 100.6 | E3: 62.6 | F3: of:=[.D3]+[.E3] -> 163.2 | G3: 478.5 | H3: of:=[.F3]/[.G3] -> 0.341065830721003
B4: tpch_q1 | C4: vectorised | D4: 101.5 | E4: 69.5 | F4: of:=[.D4]+[.E4] -> 171 | G4: 600.3 | H4: of:=[.F4]/[.G4] -> 0.284857571214393
B5: tpch_q3 | C5: non-vectorised | D5: 107 | E5: 75.9 | F5: of:=[.D5]+[.E5] -> 182.9 | G5: 454.1 | H5: of:=[.F5]/[.G5] -> 0.40277471922484
B6: tpch_q3 | C6: vectorised | D6: 106.4 | E6: 84.2 | F6: of:=[.D6]+[.E6] -> 190.6 | G6: 541.4 | H6: of:=[.F6]/[.G6] -> 0.352050240118212
B7: tpch_q6 | C7: non-vectorised | D7: 97.5 | E7: 45.6 | F7: of:=[.D7]+[.E7] -> 143.1 | G7: 278.1 | H7: of:=[.F7]/[.G7] -> 0.514563106796116
B8: tpch_q6 | C8: vectorised | D8: 95.3 | E8: 45.3 | F8: of:=[.D8]+[.E8] -> 140.6 | G8: 282.3 | H8: of:=[.F8]/[.G8] -> 0.498051718030464
B9: tpch_q10 | C9: non-vectorised | D9: 109.3 | E9: 98.7 | F9: of:=[.D9]+[.E9] -> 208 | G9: 810 | H9: of:=[.F9]/[.G9] -> 0.25679012345679
B10: tpch_q10 | C10: vectorised | D10: 108.9 | E10: 108.6 | F10: of:=[.D10]+[.E10] -> 217.5 | G10: 811.9 | H10: of:=[.F10]/[.G10] -> 0.267890134252987
B16: Becnhmark | C16: Execution | D16: Lib codegen time | E16: Lib compilation time | F16: Lib combined time | G16: Lib End-to-End Time | H16: Lib Relative time | M16: Relative time improvement
B17: tpch_q1 | C17: non-vectorised | D17: 4.2 | E17: 59.9 | F17: of:=[.D17]+[.E17] -> 64.1 | G17: 332.9 | H17: of:=[.F17]/[.G17] -> 0.192550315410033 | K17: of:=[.F17]/[.F3] -> 0.392769607843137 | M17: of:=1-[.K17] -> 0.607230392156863
B18: tpch_q1 | C18: vectorised | D18: 4.7 | E18: 58.5 | F18: of:=[.D18]+[.E18] -> 63.2 | G18: 484.9 | H18: of:=[.F18]/[.G18] -> 0.130336151783873 | K18: of:=[.F18]/[.F4] -> 0.369590643274854 | M18: of:=1-[.K18] -> 0.630409356725146
B19: tpch_q3 | C19: non-vectorised | D19: 8.2 | E19: 60.6 | F19: of:=[.D19]+[.E19] -> 68.8 | G19: 317.5 | H19: of:=[.F19]/[.G19] -> 0.216692913385827 | K19: of:=[.F19]/[.F5] -> 0.376161837069437 | M19: of:=1-[.K19] -> 0.623838162930563
B20: tpch_q3 | C20: vectorised | D20: 8.8 | E20: 60.7 | F20: of:=[.D20]+[.E20] -> 69.5 | G20: 409.4 | H20: of:=[.F20]/[.G20] -> 0.169760625305325 | K20: of:=[.F20]/[.F6] -> 0.364637985309549 | M20: of:=1-[.K20] -> 0.635362014690451
B21: tpch_q6 | C21: non-vectorised | D21: 2.2 | E21: 56 | F21: of:=[.D21]+[.E21] -> 58.2 | G21: 184.1 | H21: of:=[.F21]/[.G21] -> 0.316132536664856 | K21: of:=[.F21]/[.F7] -> 0.406708595387841 | M21: of:=1-[.K21] -> 0.593291404612159
B22: tpch_q6 | C22: vectorised | D22: 1.8 | E22: 55.4 | F22: of:=[.D22]+[.E22] -> 57.2 | G22: 183.7 | H22: of:=[.F22]/[.G22] -> 0.311377245508982 | K22: of:=[.F22]/[.F8] -> 0.406827880512091 | M22: of:=1-[.K22] -> 0.593172119487909
B23: tpch_q10 | C23: non-vectorised | D23: 14.7 | E23: 63 | F23: of:=[.D23]+[.E23] -> 77.7 | G23: 640.9 | H23: of:=[.F23]/[.G23] -> 0.121235762209393 | K23: of:=[.F23]/[.F9] -> 0.373557692307692 | M23: of:=1-[.K23] -> 0.626442307692308
B24: tpch_q10 | C24: vectorised | D24: 15.9 | E24: 64.4 | F24: of:=[.D24]+[.E24] -> 80.3 | G24: 620.8 | H24: of:=[.F24]/[.G24] -> 0.129349226804124 | K24: of:=[.F24]/[.F10] -> 0.369195402298851 | M24: of:=1-[.K24] -> 0.630804597701149