Sheet: Sheet1
B2: Benchmark | C2: Scale-Factor | D2: Paradigm | E2: ResultSummarised | G2: Execution-Time Original | I2: Record Aggregation Map Only (c1df74ae) | L2: Record Aggregation & Join Maps (ea997d873) | O2: New Initialisation Sizes (645ec8b8f)
B3: tpch_q1 | C3: 1 | D3: non-vectorised | E3: True | G3: 235 | I3: 222.9 | J3: of:=[.I3]/[.G3] -> 0.948510638297872 | L3: 235.9 | M3: of:=[.L3]/[.G3] -> 1.00382978723404 | O3: 212.9 | P3: of:=[.O3]/[.G3] -> 0.905957446808511
B4: tpch_q1 | C4: 1 | D4: vectorised | E4: True | G4: 374.2 | I4: 376.1 | J4: of:=[.I4]/[.G4] -> 1.00507749866382 | L4: 368.6 | M4: of:=[.L4]/[.G4] -> 0.985034740780332 | O4: 364.1 | P4: of:=[.O4]/[.G4] -> 0.973009086050241
B5: tpch_q1 | C5: 10 | D5: non-vectorised | E5: True | G5: 1846.7 | I5: 1703.7 | J5: of:=[.I5]/[.G5] -> 0.922564574646667 | L5: 1941.1 | M5: of:=[.L5]/[.G5] -> 1.05111821086262 | O5: 1681.3 | P5: of:=[.O5]/[.G5] -> 0.910434829696215
B6: tpch_q1 | C6: 10 | D6: vectorised | E6: True | G6: 2943.4 | I6: 2982.3 | J6: of:=[.I6]/[.G6] -> 1.01321600869742 | L6: 2951.8 | M6: of:=[.L6]/[.G6] -> 1.00285384249507 | O6: 2949.1 | P6: of:=[.O6]/[.G6] -> 1.0019365359788
B7: tpch_q1 | C7: 100 | D7: non-vectorised | E7: True | G7: 17664.5 | L7: 18364.6 | M7: of:=[.L7]/[.G7] -> 1.03963316255767 | O7: 16983.5 | P7: of:=[.O7]/[.G7] -> 0.961448102125732
B8: tpch_q1 | C8: 100 | D8: vectorised | E8: True | G8: 28456.1 | L8: 29087 | M8: of:=[.L8]/[.G8] -> 1.02217099321411 | O8: 29724.8 | P8: of:=[.O8]/[.G8] -> 1.04458446519375 | R8: old structure new init | U8: old join, new aggregation, new init
B10: tpch_q3 | C10: 1 | D10: non-vectorised | E10: True | G10: 228.8 | I10: 202.6 | J10: of:=[.I10]/[.G10] -> 0.88548951048951 | L10: 231.3 | M10: of:=[.L10]/[.G10] -> 1.01092657342657 | O10: 221.8 | P10: of:=[.O10]/[.G10] -> 0.969405594405594 | R10: 199.9 | S10: of:=[.R10]/[.G10] -> 0.873688811188811 | U10: 192 | V10: of:=[.U10]/[.G10] -> 0.839160839160839
B11: tpch_q3 | C11: 1 | D11: vectorised | E11: True | G11: 295 | I11: 294.1 | J11: of:=[.I11]/[.G11] -> 0.996949152542373 | L11: 260.2 | M11: of:=[.L11]/[.G11] -> 0.882033898305085 | O11: 225.8 | P11: of:=[.O11]/[.G11] -> 0.765423728813559 | R11: 202.1 | S11: of:=[.R11]/[.G11] -> 0.685084745762712 | U11: 198.1 | V11: of:=[.U11]/[.G11] -> 0.671525423728814
B12: tpch_q3 | C12: 10 | D12: non-vectorised | E12: True | G12: 1909.2 | I12: 1841.4 | J12: of:=[.I12]/[.G12] -> 0.964487743557511 | L12: 2363.7 | M12: of:=[.L12]/[.G12] -> 1.23805782526713 | O12: 2250.1 | P12: of:=[.O12]/[.G12] -> 1.17855646344018 | R12: 1842.4 | S12: of:=[.R12]/[.G12] -> 0.965011523151058 | U12: 1842.5 | V12: of:=[.U12]/[.G12] -> 0.965063901110413
B13: tpch_q3 | C13: 10 | D13: vectorised | E13: True | G13: 1974.1 | I13: 1945.4 | J13: of:=[.I13]/[.G13] -> 0.985461729395674 | L13: 2339.7 | M13: of:=[.L13]/[.G13] -> 1.18519831822096 | O13: 2239.2 | P13: of:=[.O13]/[.G13] -> 1.13428904310825 | R13: 1879.7 | S13: of:=[.R13]/[.G13] -> 0.952180740590649 | U13: 1887.6 | V13: of:=[.U13]/[.G13] -> 0.956182564206474
B14: tpch_q3 | C14: 100 | D14: non-vectorised | E14: True | G14: 23318.6 | L14: 27826.2 | M14: of:=[.L14]/[.G14] -> 1.19330491538943 | O14: 23752.1 | P14: of:=[.O14]/[.G14] -> 1.01859030988138 | R14: 20409.3 | S14: of:=[.R14]/[.G14] -> 0.875236935322018 | U14: 20681.8 | V14: of:=[.U14]/[.G14] -> 0.886922885593475
B15: tpch_q3 | C15: 100 | D15: vectorised | E15: True | G15: 23938 | L15: 27861.4 | M15: of:=[.L15]/[.G15] -> 1.16389840421088 | O15: 23751.6 | P15: of:=[.O15]/[.G15] -> 0.992213217478486 | R15: 20671.1 | S15: of:=[.R15]/[.G15] -> 0.863526610410226 | U15: 20577.5 | V15: of:=[.U15]/[.G15] -> 0.859616509315732
B17: tpch_q6 | C17: 1 | D17: non-vectorised | E17: False | G17: 95.5 | I17: 81.7 | J17: of:=[.I17]/[.G17] -> 0.855497382198953 | L17: 81.7 | M17: of:=[.L17]/[.G17] -> 0.855497382198953 | O17: 82.5 | P17: of:=[.O17]/[.G17] -> 0.863874345549738
B18: tpch_q6 | C18: 1 | D18: vectorised | E18: False | G18: 84.5 | I18: 82.6 | J18: of:=[.I18]/[.G18] -> 0.977514792899408 | L18: 82.6 | M18: of:=[.L18]/[.G18] -> 0.977514792899408 | O18: 82.3 | P18: of:=[.O18]/[.G18] -> 0.97396449704142
B19: tpch_q6 | C19: 10 | D19: non-vectorised | E19: False | G19: 381.7 | I19: 366 | J19: of:=[.I19]/[.G19] -> 0.95886822111606 | L19: 372.5 | M19: of:=[.L19]/[.G19] -> 0.975897301545717 | O19: 373.6 | P19: of:=[.O19]/[.G19] -> 0.97877914592612
B20: tpch_q6 | C20: 10 | D20: vectorised | E20: False | G20: 362.2 | I20: 366.3 | J20: of:=[.I20]/[.G20] -> 1.01131971286582 | L20: 357.4 | M20: of:=[.L20]/[.G20] -> 0.98674765323026 | O20: 367.1 | P20: of:=[.O20]/[.G20] -> 1.01352843732744
B21: tpch_q6 | C21: 100 | D21: non-vectorised | E21: False | G21: 3079.3 | L21: 3040.5 | M21: of:=[.L21]/[.G21] -> 0.987399733705712 | O21: 3091.6 | P21: of:=[.O21]/[.G21] -> 1.00399441431494
B22: tpch_q6 | C22: 100 | D22: vectorised | E22: False | G22: 3020.7 | L22: 2971.8 | M22: of:=[.L22]/[.G22] -> 0.983811699275003 | O22: 3056.4 | P22: of:=[.O22]/[.G22] -> 1.01181845267653
B24: tpch_q10 | C24: 1 | D24: non-vectorised | E24: True | G24: 530 | I24: 517 | J24: of:=[.I24]/[.G24] -> 0.975471698113208 | L24: 363.8 | M24: of:=[.L24]/[.G24] -> 0.686415094339623 | O24: 397.1 | P24: of:=[.O24]/[.G24] -> 0.749245283018868 | R24: 524.4 | S24: of:=[.R24]/[.G24] -> 0.989433962264151 | U24: 488.6 | V24: of:=[.U24]/[.G24] -> 0.92188679245283
B25: tpch_q10 | C25: 1 | D25: vectorised | E25: True | G25: 503 | I25: 494.4 | J25: of:=[.I25]/[.G25] -> 0.982902584493042 | L25: 360.3 | M25: of:=[.L25]/[.G25] -> 0.716302186878728 | O25: 357.9 | P25: of:=[.O25]/[.G25] -> 0.711530815109344 | R25: 478.3 | S25: of:=[.R25]/[.G25] -> 0.95089463220676 | U25: 484.9 | V25: of:=[.U25]/[.G25] -> 0.964015904572565
B26: tpch_q10 | C26: 10 | D26: non-vectorised | E26: True | G26: 5362.3 | I26: 5383.7 | J26: of:=[.I26]/[.G26] -> 1.00399082483263 | L26: 3436.6 | M26: of:=[.L26]/[.G26] -> 0.640881711206012 | O26: 3260.6 | P26: of:=[.O26]/[.G26] -> 0.608059974264774 | R26: 4618.1 | S26: of:=[.R26]/[.G26] -> 0.861216269138243 | U26: 4500.5 | V26: of:=[.U26]/[.G26] -> 0.839285381272961
B27: tpch_q10 | C27: 10 | D27: vectorised | E27: True | G27: 4752 | I27: 4690.7 | J27: of:=[.I27]/[.G27] -> 0.987100168350168 | L27: 2924.1 | M27: of:=[.L27]/[.G27] -> 0.615340909090909 | O27: 2707.5 | P27: of:=[.O27]/[.G27] -> 0.569760101010101 | R27: 4223.4 | S27: of:=[.R27]/[.G27] -> 0.888762626262626 | U27: 4087.4 | V27: of:=[.U27]/[.G27] -> 0.860143097643098
B28: tpch_q10 | C28: 100 | D28: non-vectorised | E28: True | G28: 86377.8 | L28: 36866.9 | M28: of:=[.L28]/[.G28] -> 0.426809897913584 | O28: 33649.2 | P28: of:=[.O28]/[.G28] -> 0.389558428207248 | R28: 52201.9 | S28: of:=[.R28]/[.G28] -> 0.604343940225382 | U28: 51162.2 | V28: of:=[.U28]/[.G28] -> 0.592307282658276
B29: tpch_q10 | C29: 100 | D29: vectorised | E29: True | G29: 87163.2 | L29: 30965.5 | M29: of:=[.L29]/[.G29] -> 0.355258870716082 | O29: 26104.5 | P29: of:=[.O29]/[.G29] -> 0.299489922352552 | R29: 38501.4 | S29: of:=[.R29]/[.G29] -> 0.441716228867228 | V29: of:=[.U29]/[.G29] -> 0
B32: Isolated performance runs | D32: OpenJDK 21 | E32: 10 Repetitions | G32: AethraDB.test
B34: Git Commit: | D34: 742c643987e4fdcb0d72a60db5592ff903a1157d
B35: Execution command: | D35: /usr/lib/jvm/java-21-openjdk/bin/java --add-opens=java.base/java.nio=ALL-UNNAMED --enable-preview -Darrow.enable_unsafe_memory_access=true -Darrow.enable_null_check_for_get=false -Xmx32g -Xms16g -classpath /home/olivier/Repositories/AethraDB/target/classes:/home/olivier/.m2/repository/org/openjdk/jmh/jmh-core/1.36/jmh-core-1.36.jar:/home/olivier/.m2/repository/net/sf/jopt-simple/jopt-simple/5.0.4/jopt-simple-5.0.4.jar:/home/olivier/.m2/repository/org/apache/commons/commons-math3/3.2/commons-math3-3.2.jar:/home/olivier/.m2/repository/commons-cli/commons-cli/1.5.0/commons-cli-1.5.0.jar:/home/olivier/.m2/repository/org/apache/commons/commons-csv/1.10.0/commons-csv-1.10.0.jar:/home/olivier/.m2/repository/org/apache/commons/commons-lang3/3.13.0/commons-lang3-3.13.0.jar:/home/olivier/.m2/repository/org/codehaus/janino/janino/3.1.9/janino-3.1.9.jar:/home/olivier/.m2/repository/org/codehaus/janino/commons-compiler/3.1.9/commons-compiler-3.1.9.jar:/home/olivier/.m2/repository/org/slf4j/slf4j-api/2.0.9/slf4j-api-2.0.9.jar:/home/olivier/.m2/repository/org/slf4j/slf4j-nop/2.0.9/slf4j-nop-2.0.9.jar:/home/olivier/.m2/repository/com/google/flatbuffers/flatbuffers-java/1.12.0/flatbuffers-java-1.12.0.jar:/home/olivier/.m2/repository/com/google/code/findbugs/jsr305/3.0.2/jsr305-3.0.2.jar:/home/olivier/.m2/repository/javax/annotation/javax.annotation-api/1.3.2/javax.annotation-api-1.3.2.jar:/home/olivier/.m2/repository/com/fasterxml/jackson/core/jackson-core/2.15.1/jackson-core-2.15.1.jar:/home/olivier/.m2/repository/com/fasterxml/jackson/core/jackson-annotations/2.15.1/jackson-annotations-2.15.1.jar:/home/olivier/.m2/repository/com/fasterxml/jackson/core/jackson-databind/2.15.1/jackson-databind-2.15.1.jar:/home/olivier/.m2/repository/com/fasterxml/jackson/datatype/jackson-datatype-jsr310/2.15.1/jackson-datatype-jsr310-2.15.1.jar:/home/olivier/.m2/repository/io/netty/netty-common/4.1.96.Final/netty-common-4.1.96.Final.jar:/home/olivier/.m2/repository/commons-codec/commons-codec/1.15/commons-codec-1.15.jar AethraDB.test.Q3NV_Current /nvtmp/AethraTestData/tpch/sf-1
B37: tpch_q3 | C37: 1 | D37: non-vectorised | E37: Original | G37: of:=AVERAGE(270;265;291;290;270;276;273;275;270;273) -> 275.3
B38: tpch_q3 | C38: 1 | D38: non-vectorised | E38: Original new Init | G38: of:=AVERAGE(241;279;243;245;239;240;312;246;277;252) -> 257.4
B39: tpch_q3 | C39: 1 | D39: non-vectorised | E39: Current | G39: of:=AVERAGE(307;263;250;289;294;269;286;271;298;255) -> 278.2
B41: tpch_q3 | C41: 10 | D41: non-vectorised | E41: Original | G41: of:=AVERAGE(2445;2474;2409;2424;2438;2424;2444;2463;2446;2478) -> 2444.5
B42: tpch_q3 | C42: 10 | D42: non-vectorised | E42: Original new Init | G42: of:=AVERAGE(1962;1980;2008;1914;1956;2029;1879;1922;1944;1961) -> 1955.5
B43: tpch_q3 | C43: 10 | D43: non-vectorised | E43: Current | G43: of:=AVERAGE(2492;2543;2381;2326;2270;2366;2343;2426;2422;2424) -> 2399.3
B45: tpch_q3 | C45: 100 | D45: non-vectorised | E45: Original | G45: of:=AVERAGE(34437;31086;31316) -> 32279.6666666667
B46: tpch_q3 | C46: 100 | D46: non-vectorised | E46: Original new Init | G46: of:=AVERAGE(31779;21580;21915) -> 25091.3333333333
B47: tpch_q3 | C47: 100 | D47: non-vectorised | E47: Current | G47: of:=AVERAGE(27399;26829;24578) -> 26268.6666666667