Sheet: Sheet1
B2: Query | C2: Engine | D2: Running-Time (ms) | E2: Relative Running-Time (DuckDB) | F2: Relative Running-Time (Aethra NV-NS) | H2: Comments
B3: TPC-H Q1 Without Sorting | C3: Aethra NV-NS | D3: 231 | E3: of:=[.D3]/[.$D$9] -> 0.501084598698482 | H3: The behaviour that the NV engines are approx 2x faster than the V engines matches the “Everything you’ve always wanted to know” paper
C4: Aethra NV-S (SIMD filtering, manual) | D4: 280 | E4: of:=[.D4]/[.$D$9] -> 0.607375271149675 | F4: of:=[.D4]/[.$D$3] -> 1.21212121212121 | H4: Perhaps the SIMD filtering is ineffective here due to the fact that almost all tuples pass the filter (98.5% passes)
C5: Aethra V-NS | D5: 420 | E5: of:=[.D5]/[.$D$9] -> 0.911062906724512 | F5: of:=[.D5]/[.$D$3] -> 1.81818181818182 | H5: Apparently performing arithmetic on all elements of the vector, and projecting the valid ones out later, helps in the V-NS engine. Perhaps due to increased use of pipelining
C6: Aethra V-NS (RedSelVec) | D6: 397 | E6: of:=[.D6]/[.$D$9] -> 0.86117136659436 | F6: of:=[.D6]/[.$D$3] -> 1.71861471861472
C7: Aethra V-S | D7: 473 | E7: of:=[.D7]/[.$D$9] -> 1.02603036876356 | F7: of:=[.D7]/[.$D$3] -> 2.04761904761905 | H7: But: for the V-S engine, this does not hold true: it is actually cheaper to “perform arithmetic” only on the valid entries. Perhaps this reduces the cost of moving elements into SIMD registers
C8: Aethra V-S (RedValMask) | D8: 542 | E8: of:=[.D8]/[.$D$9] -> 1.17570498915401 | F8: of:=[.D8]/[.$D$3] -> 2.34632034632035
C9: DuckDB 0.7.1 (PyArrow 11.0.0) | D9: 461 | H9: DuckDB is significantly slower than our NV-NS engine (could be due to paradigm) But: our data is already in memory at the start of the query, whereas duckdb may need to read it from disk
E11: Relative Running-Time (Original) | F11: Relative Running-Time (DuckDB)
B12: TPC-H Q1 Without Sorting (ABQArrowReader) | C12: Aethra NV-NS | D12: 251 | E12: of:=[.D12]/[.D3] -> 1.08658008658009 | F12: of:=[.D12]/[.$D$18] -> 0.544468546637744
C13: Aethra NV-S (SIMD filtering, manual) | D13: 300 | E13: of:=[.D13]/[.D4] -> 1.07142857142857 | F13: of:=[.D13]/[.$D$18] -> 0.650759219088937
C14: Aethra V-NS | D14: 496 | E14: of:=[.D14]/[.D5] -> 1.18095238095238 | F14: of:=[.D14]/[.$D$18] -> 1.07592190889371 | H14: It seems that especially the non-simded vectorised engine is impacted by the new ABQArrowReader. Perhaps we can improve this by caching more vectors
C15: Aethra V-NS (RedSelVec) | D15: 480 | E15: of:=[.D15]/[.D6] -> 1.20906801007557 | F15: of:=[.D15]/[.$D$18] -> 1.0412147505423
C16: Aethra V-S | D16: 489 | E16: of:=[.D16]/[.D7] -> 1.0338266384778 | F16: of:=[.D16]/[.$D$18] -> 1.06073752711497
C17: Aethra V-S (RedValMask) | D17: 558 | E17: of:=[.D17]/[.D8] -> 1.02952029520295 | F17: of:=[.D17]/[.$D$18] -> 1.21041214750542
C18: DuckDB 0.7.1 (PyArrow 11.0.0) | D18: 461