Sheet: Sheet1
B2: Benchmark | C2: Scale-Factor | D2: Paradigm | E2: Result Summarised | G2: Execution-Time Original | I2: Record Aggregation Map Only (c1df74ae) | L2: Record Aggregation & Join Maps (ea997d873) | O2: New Initialisation Sizes (645ec8b8f) | R2: Reduced Overhead (197bba2bab) | U2: Hybrid Join Map (cda4ade6461) | X2: Hybrid Join Map w. Next Indices (64b54f23e)
B3: tpch_q1 | C3: 1 | D3: non-vectorised | E3: True | G3: 235 | I3: 222.9 | J3: of:=[.I3]/[.G3] -> 0.948510638297872 | L3: 235.9 | M3: of:=[.L3]/[.G3] -> 1.00382978723404 | O3: 212.9 | P3: of:=[.O3]/[.G3] -> 0.905957446808511 | R3: 239.3 | S3: of:=[.R3]/[.G3] -> 1.01829787234043 | U3: 236.2 | V3: of:=[.U3]/[.G3] -> 1.00510638297872 | X3: 234 | Y3: of:=[.X3]/[.G3] -> 0.995744680851064
B4: tpch_q1 | C4: 1 | D4: vectorised | E4: True | G4: 374.2 | I4: 376.1 | J4: of:=[.I4]/[.G4] -> 1.00507749866382 | L4: 368.6 | M4: of:=[.L4]/[.G4] -> 0.985034740780332 | O4: 364.1 | P4: of:=[.O4]/[.G4] -> 0.973009086050241 | R4: 365.9 | S4: of:=[.R4]/[.G4] -> 0.977819347942277 | U4: 365.4 | V4: of:=[.U4]/[.G4] -> 0.976483164083378 | X4: 390.2 | Y4: of:=[.X4]/[.G4] -> 1.04275788348477
B5: tpch_q1 | C5: 10 | D5: non-vectorised | E5: True | G5: 1846.7 | I5: 1703.7 | J5: of:=[.I5]/[.G5] -> 0.922564574646667 | L5: 1941.1 | M5: of:=[.L5]/[.G5] -> 1.05111821086262 | O5: 1681.3 | P5: of:=[.O5]/[.G5] -> 0.910434829696215 | R5: 1933.2 | S5: of:=[.R5]/[.G5] -> 1.0468403097417 | U5: 1934.6 | V5: of:=[.U5]/[.G5] -> 1.0475984188011 | X5: 1931.3 | Y5: of:=[.X5]/[.G5] -> 1.0458114474468
B6: tpch_q1 | C6: 10 | D6: vectorised | E6: True | G6: 2943.4 | I6: 2982.3 | J6: of:=[.I6]/[.G6] -> 1.01321600869742 | L6: 2951.8 | M6: of:=[.L6]/[.G6] -> 1.00285384249507 | O6: 2949.1 | P6: of:=[.O6]/[.G6] -> 1.0019365359788 | R6: 2927.1 | S6: of:=[.R6]/[.G6] -> 0.99446218658694 | U6: 2923.2 | V6: of:=[.U6]/[.G6] -> 0.993137188285656 | X6: 3147.3 | Y6: of:=[.X6]/[.G6] -> 1.06927362913637
B7: tpch_q1 | C7: 100 | D7: non-vectorised | E7: True | G7: 17664.5 | L7: 18364.6 | M7: of:=[.L7]/[.G7] -> 1.03963316255767 | O7: 16983.5 | P7: of:=[.O7]/[.G7] -> 0.961448102125732 | R7: 18790.3 | S7: of:=[.R7]/[.G7] -> 1.06373234453282 | U7: 18751.6 | V7: of:=[.U7]/[.G7] -> 1.06154150980781 | X7: 19135.5 | Y7: of:=[.X7]/[.G7] -> 1.08327436383707
B8: tpch_q1 | C8: 100 | D8: vectorised | E8: True | G8: 28456.1 | L8: 29087 | M8: of:=[.L8]/[.G8] -> 1.02217099321411 | O8: 29724.8 | P8: of:=[.O8]/[.G8] -> 1.04458446519375 | R8: 30737.7 | S8: of:=[.R8]/[.G8] -> 1.0801796451376 | U8: 29108.3 | V8: of:=[.U8]/[.G8] -> 1.02291951462077 | X8: 29740.5 | Y8: of:=[.X8]/[.G8] -> 1.04513619223998
B10: tpch_q3 | C10: 1 | D10: non-vectorised | E10: True | G10: 228.8 | I10: 202.6 | J10: of:=[.I10]/[.G10] -> 0.88548951048951 | L10: 231.3 | M10: of:=[.L10]/[.G10] -> 1.01092657342657 | O10: 221.8 | P10: of:=[.O10]/[.G10] -> 0.969405594405594 | R10: 221.8 | S10: of:=[.R10]/[.G10] -> 0.969405594405594 | U10: 213.5 | V10: of:=[.U10]/[.G10] -> 0.933129370629371 | X10: 215 | Y10: of:=[.X10]/[.G10] -> 0.939685314685315
B11: tpch_q3 | C11: 1 | D11: vectorised | E11: True | G11: 295 | I11: 294.1 | J11: of:=[.I11]/[.G11] -> 0.996949152542373 | L11: 260.2 | M11: of:=[.L11]/[.G11] -> 0.882033898305085 | O11: 225.8 | P11: of:=[.O11]/[.G11] -> 0.765423728813559 | R11: 221.6 | S11: of:=[.R11]/[.G11] -> 0.751186440677966 | U11: 209.4 | V11: of:=[.U11]/[.G11] -> 0.709830508474576 | X11: 205 | Y11: of:=[.X11]/[.G11] -> 0.694915254237288
B12: tpch_q3 | C12: 10 | D12: non-vectorised | E12: True | G12: 1909.2 | I12: 1841.4 | J12: of:=[.I12]/[.G12] -> 0.964487743557511 | L12: 2363.7 | M12: of:=[.L12]/[.G12] -> 1.23805782526713 | O12: 2250.1 | P12: of:=[.O12]/[.G12] -> 1.17855646344018 | R12: 2266.9 | S12: of:=[.R12]/[.G12] -> 1.18735596061177 | U12: 1898.8 | V12: of:=[.U12]/[.G12] -> 0.994552692227111 | X12: 1890.3 | Y12: of:=[.X12]/[.G12] -> 0.990100565681961
B13: tpch_q3 | C13: 10 | D13: vectorised | E13: True | G13: 1974.1 | I13: 1945.4 | J13: of:=[.I13]/[.G13] -> 0.985461729395674 | L13: 2339.7 | M13: of:=[.L13]/[.G13] -> 1.18519831822096 | O13: 2239.2 | P13: of:=[.O13]/[.G13] -> 1.13428904310825 | R13: 2176.4 | S13: of:=[.R13]/[.G13] -> 1.1024770781622 | U13: 1854.7 | V13: of:=[.U13]/[.G13] -> 0.939516741806393 | X13: 1850.5 | Y13: of:=[.X13]/[.G13] -> 0.937389190010638
B14: tpch_q3 | C14: 100 | D14: non-vectorised | E14: True | G14: 23318.6 | L14: 27826.2 | M14: of:=[.L14]/[.G14] -> 1.19330491538943 | O14: 23752.1 | P14: of:=[.O14]/[.G14] -> 1.01859030988138 | R14: 23633.3 | S14: of:=[.R14]/[.G14] -> 1.01349566440524 | U14: 21120.8 | V14: of:=[.U14]/[.G14] -> 0.905749058691345 | X14: 21318.3 | Y14: of:=[.X14]/[.G14] -> 0.914218692374328
B15: tpch_q3 | C15: 100 | D15: vectorised | E15: True | G15: 23938 | L15: 27861.4 | M15: of:=[.L15]/[.G15] -> 1.16389840421088 | O15: 23751.6 | P15: of:=[.O15]/[.G15] -> 0.992213217478486 | R15: 22856.1 | S15: of:=[.R15]/[.G15] -> 0.954804077199432 | U15: 21243 | V15: of:=[.U15]/[.G15] -> 0.887417495195923 | X15: 21332.3 | Y15: of:=[.X15]/[.G15] -> 0.891147965577743
B17: tpch_q6 | C17: 1 | D17: non-vectorised | E17: False | G17: 95.5 | I17: 81.7 | J17: of:=[.I17]/[.G17] -> 0.855497382198953 | L17: 81.7 | M17: of:=[.L17]/[.G17] -> 0.855497382198953 | O17: 82.5 | P17: of:=[.O17]/[.G17] -> 0.863874345549738 | R17: 82.1 | S17: of:=[.R17]/[.G17] -> 0.859685863874346 | U17: 82.5 | V17: of:=[.U17]/[.G17] -> 0.863874345549738
B18: tpch_q6 | C18: 1 | D18: vectorised | E18: False | G18: 84.5 | I18: 82.6 | J18: of:=[.I18]/[.G18] -> 0.977514792899408 | L18: 82.6 | M18: of:=[.L18]/[.G18] -> 0.977514792899408 | O18: 82.3 | P18: of:=[.O18]/[.G18] -> 0.97396449704142 | R18: 84.4 | S18: of:=[.R18]/[.G18] -> 0.998816568047337 | U18: 82.6 | V18: of:=[.U18]/[.G18] -> 0.977514792899408
B19: tpch_q6 | C19: 10 | D19: non-vectorised | E19: False | G19: 381.7 | I19: 366 | J19: of:=[.I19]/[.G19] -> 0.95886822111606 | L19: 372.5 | M19: of:=[.L19]/[.G19] -> 0.975897301545717 | O19: 373.6 | P19: of:=[.O19]/[.G19] -> 0.97877914592612 | R19: 362.6 | S19: of:=[.R19]/[.G19] -> 0.949960702122086 | U19: 371.4 | V19: of:=[.U19]/[.G19] -> 0.973015457165313
B20: tpch_q6 | C20: 10 | D20: vectorised | E20: False | G20: 362.2 | I20: 366.3 | J20: of:=[.I20]/[.G20] -> 1.01131971286582 | L20: 357.4 | M20: of:=[.L20]/[.G20] -> 0.98674765323026 | O20: 367.1 | P20: of:=[.O20]/[.G20] -> 1.01352843732744 | R20: 365 | S20: of:=[.R20]/[.G20] -> 1.00773053561568 | U20: 366.8 | V20: of:=[.U20]/[.G20] -> 1.01270016565433
B21: tpch_q6 | C21: 100 | D21: non-vectorised | E21: False | G21: 3079.3 | L21: 3040.5 | M21: of:=[.L21]/[.G21] -> 0.987399733705712 | O21: 3091.6 | P21: of:=[.O21]/[.G21] -> 1.00399441431494 | R21: 3078.2 | S21: of:=[.R21]/[.G21] -> 0.999642775955574 | U21: 3098.1 | V21: of:=[.U21]/[.G21] -> 1.00610528366837
B22: tpch_q6 | C22: 100 | D22: vectorised | E22: False | G22: 3020.7 | L22: 2971.8 | M22: of:=[.L22]/[.G22] -> 0.983811699275003 | O22: 3056.4 | P22: of:=[.O22]/[.G22] -> 1.01181845267653 | R22: 3034.7 | S22: of:=[.R22]/[.G22] -> 1.00463468732413 | U22: 3032.9 | V22: of:=[.U22]/[.G22] -> 1.00403879895389
B24: tpch_q10 | C24: 1 | D24: non-vectorised | E24: True | G24: 530 | I24: 517 | J24: of:=[.I24]/[.G24] -> 0.975471698113208 | L24: 363.8 | M24: of:=[.L24]/[.G24] -> 0.686415094339623 | O24: 397.1 | P24: of:=[.O24]/[.G24] -> 0.749245283018868 | R24: 341.8 | S24: of:=[.R24]/[.G24] -> 0.644905660377359 | U24: 379.3 | V24: of:=[.U24]/[.G24] -> 0.715660377358491 | X24: 376.8 | Y24: of:=[.X24]/[.G24] -> 0.710943396226415
B25: tpch_q10 | C25: 1 | D25: vectorised | E25: True | G25: 503 | I25: 494.4 | J25: of:=[.I25]/[.G25] -> 0.982902584493042 | L25: 360.3 | M25: of:=[.L25]/[.G25] -> 0.716302186878728 | O25: 357.9 | P25: of:=[.O25]/[.G25] -> 0.711530815109344 | R25: 301.3 | S25: of:=[.R25]/[.G25] -> 0.599005964214712 | U25: 327.6 | V25: of:=[.U25]/[.G25] -> 0.651292246520875 | X25: 334.3 | Y25: of:=[.X25]/[.G25] -> 0.664612326043738
B26: tpch_q10 | C26: 10 | D26: non-vectorised | E26: True | G26: 5362.3 | I26: 5383.7 | J26: of:=[.I26]/[.G26] -> 1.00399082483263 | L26: 3436.6 | M26: of:=[.L26]/[.G26] -> 0.640881711206012 | O26: 3260.6 | P26: of:=[.O26]/[.G26] -> 0.608059974264774 | R26: 2993.1 | S26: of:=[.R26]/[.G26] -> 0.558174663856927 | U26: 3078.5 | V26: of:=[.U26]/[.G26] -> 0.574100665759096 | X26: 3075.7 | Y26: of:=[.X26]/[.G26] -> 0.573578501762303
B27: tpch_q10 | C27: 10 | D27: vectorised | E27: True | G27: 4752 | I27: 4690.7 | J27: of:=[.I27]/[.G27] -> 0.987100168350168 | L27: 2924.1 | M27: of:=[.L27]/[.G27] -> 0.615340909090909 | O27: 2707.5 | P27: of:=[.O27]/[.G27] -> 0.569760101010101 | R27: 2427.9 | S27: of:=[.R27]/[.G27] -> 0.510921717171717 | U27: 2488.2 | V27: of:=[.U27]/[.G27] -> 0.523611111111111 | X27: 2478.5 | Y27: of:=[.X27]/[.G27] -> 0.521569865319865
B28: tpch_q10 | C28: 100 | D28: non-vectorised | E28: True | G28: 86377.8 | L28: 36866.9 | M28: of:=[.L28]/[.G28] -> 0.426809897913584 | O28: 33649.2 | P28: of:=[.O28]/[.G28] -> 0.389558428207248 | R28: 34210 | S28: of:=[.R28]/[.G28] -> 0.396050837136394 | U28: 31961.8 | V28: of:=[.U28]/[.G28] -> 0.370023316176147 | X28: 32853.9 | Y28: of:=[.X28]/[.G28] -> 0.380351201350347
B29: tpch_q10 | C29: 100 | D29: vectorised | E29: True | G29: 87163.2 | L29: 30965.5 | M29: of:=[.L29]/[.G29] -> 0.355258870716082 | O29: 26104.5 | P29: of:=[.O29]/[.G29] -> 0.299489922352552 | R29: 26285.8 | S29: of:=[.R29]/[.G29] -> 0.301569928593718 | U29: 23731.3 | V29: of:=[.U29]/[.G29] -> 0.272262835692127 | X29: 26164.2 | Y29: of:=[.X29]/[.G29] -> 0.300174844429759