Sheet: Sheet1
C2: AethraDB Non-Vec | D2: AethraDB Vec | E2: Relative
B3: Context-switches | C3: 63448 | D3: 73151 | E3: of:=[.C3]/[.D3] -> 0.867356563820043
B4: CPU migrations | C4: 170 | D4: 156 | E4: of:=[.C4]/[.D4] -> 1.08974358974359
B5: Page faults | C5: 955209 | D5: 949655 | E5: of:=[.C5]/[.D5] -> 1.00584843969652
B6: Cycles | C6: 173783156118 | D6: 168490252783 | E6: of:=[.C6]/[.D6] -> 1.0314137064167
B7: Instructions | C7: 197172874764 | D7: 181515955844 | E7: of:=[.C7]/[.D7] -> 1.08625643320004
B8: Instructions per Cycle | C8: of:=[.C7]/[.C6] -> 1.13459140211562 | D8: of:=[.D7]/[.D6] -> 1.07730834778779 | E8: of:=[.C8]/[.D8] -> 1.0531723850887
B9: Branches | C9: 35869910324 | D9: 28513614120 | E9: of:=[.C9]/[.D9] -> 1.25799241629072
B10: Branch-misses | C10: 618334818 | D10: 643785688 | E10: of:=[.C10]/[.D10] -> 0.960466859586354
B11: Branch-misses relative (%) | C11: of:=[.C10]/[.C9]*100 -> 1.72382593771438 | D11: of:=[.D10]/[.D9]*100 -> 2.25781861706698 | E11: of:=[.C11]/[.D11] -> 0.7634917724054
B12: Cache-references | C12: 4995203143 | D12: 6772153737 | E12: of:=[.C12]/[.D12] -> 0.737609235848923
B13: Cache-misses | C13: 2384332860 | D13: 2616985260 | E13: of:=[.C13]/[.D13] -> 0.911099078945519
B14: Cache-misses relative (%) | C14: of:=[.C13]/[.C12]*100 -> 47.7324503477155 | D14: of:=[.D13]/[.D12]*100 -> 38.6433232562629 | E14: of:=[.C14]/[.D14] -> 1.23520562740368
B15: L1-dcache-load-misses | C15: 2704840823 | D15: 3536115127 | E15: of:=[.C15]/[.D15] -> 0.764918767024069
B16: L1-dcache-loads | C16: 53298417093 | D16: 54566793831 | E16: of:=[.C16]/[.D16] -> 0.976755520180857
B17: L1-dcache-load-misses relative (%) | C17: of:=[.C15]/[.C16]*100 -> 5.07489897548054 | D17: of:=[.D15]/[.D16]*100 -> 6.48034249172084 | E17: of:=[.C17]/[.D17] -> 0.78312203127599
B18: L1-dcache-stores | C18: 19131461707 | D18: 18476283085 | E18: of:=[.C18]/[.D18] -> 1.03546052087348
B19: L1-icache-load-misses | C19: 425365510 | D19: 404719576 | E19: of:=[.C19]/[.D19] -> 1.05101293642391
B21: Time elapsed | C21: 27.8 | D21: 26.5 | E21: of:=[.C21]/[.D21] -> 1.04905660377359 | G21: ‚Üê This difference is slightly smaller than on the benchmarks
B24: Performance difference hypothesis: | C24: Many more cycles & instructions in NV code
C25: Many more branches
C26: Relatively higher percentage of cache misses
B28: But | C28: Fewer branch misses, and fewer L1 cache load misses compared to vec