Sheet: Sheet1
D2: Original Run (ms) | E2: Custom Map (ms) | G2: Hard coded custom map with better size (ms)
B3: A_B_0.2_C_0.2 | C3: NVNS | D3: 1290 | E3: 2641 | F3: of:=[.E3]/[.D3] -> 2.04728682170543 | G3: 1916 | H3: of:=[.G3]/[.D3] -> 1.48527131782946
C4: NVS | D4: 1611 | E4: 2968 | F4: of:=[.E4]/[.D4] -> 1.8423339540658 | G4: 2284 | H4: of:=[.G4]/[.D4] -> 1.41775294847921
C5: VNS | D5: 1244 | G5: 1837 | H5: of:=[.G5]/[.D5] -> 1.47668810289389
C6: VS | D6: 1422 | G6: 2008 | H6: of:=[.G6]/[.D6] -> 1.41209563994374
B7: A_B_0.2_C_0.8 | C7: NVNS | D7: 1364 | E7: 2751 | F7: of:=[.E7]/[.D7] -> 2.01686217008798 | G7: 2078 | H7: of:=[.G7]/[.D7] -> 1.52346041055718
C8: NVS | D8: 1688 | E8: 3136 | F8: of:=[.E8]/[.D8] -> 1.85781990521327 | G8: 2462 | H8: of:=[.G8]/[.D8] -> 1.4585308056872
C9: VNS | D9: 1318 | G9: 2019 | H9: of:=[.G9]/[.D9] -> 1.53186646433991
C10: VS | D10: 1521 | G10: 2158 | H10: of:=[.G10]/[.D10] -> 1.41880341880342
B11: A_B_0.4_C_0.2 | C11: NVNS | D11: 1746 | E11: 3266 | F11: of:=[.E11]/[.D11] -> 1.87056128293242 | G11: 2824 | H11: of:=[.G11]/[.D11] -> 1.61741122565865
C12: NVS | D12: 2090 | E12: 3636 | F12: of:=[.E12]/[.D12] -> 1.73971291866029 | G12: 3221 | H12: of:=[.G12]/[.D12] -> 1.54114832535885
C13: VNS | D13: 1664 | G13: 2702 | H13: of:=[.G13]/[.D13] -> 1.62379807692308
C14: VS | D14: 1891 | G14: 2851 | H14: of:=[.G14]/[.D14] -> 1.5076679005817
B15: A_B_0.4_C_0.8 | C15: NVNS | D15: 1882 | E15: 3445 | F15: of:=[.E15]/[.D15] -> 1.83049946865037 | G15: 3092 | H15: of:=[.G15]/[.D15] -> 1.64293304994687
C16: NVS | D16: 2229 | E16: 3916 | F16: of:=[.E16]/[.D16] -> 1.75684163301929 | G16: 3483 | H16: of:=[.G16]/[.D16] -> 1.56258411843876
C17: VNS | D17: 1835 | G17: 2995 | H17: of:=[.G17]/[.D17] -> 1.63215258855586
C18: VS | D18: 2085 | G18: 3139 | H18: of:=[.G18]/[.D18] -> 1.50551558752998
B19: A_B_0.6_C_0.2 | C19: NVNS | D19: 2222 | E19: 4530 | F19: of:=[.E19]/[.D19] -> 2.03870387038704 | G19: 3600 | H19: of:=[.G19]/[.D19] -> 1.62016201620162
C20: NVS | D20: 2609 | E20: 4969 | F20: of:=[.E20]/[.D20] -> 1.9045611345343 | G20: 3997 | H20: of:=[.G20]/[.D20] -> 1.5320045994634
C21: VNS | D21: 2140 | G21: 3357 | H21: of:=[.G21]/[.D21] -> 1.56869158878505
C22: VS | D22: 2370 | G22: 3429 | H22: of:=[.G22]/[.D22] -> 1.44683544303797
B23: A_B_0.6_C_0.8 | C23: NVNS | D23: 2415 | E23: 4761 | F23: of:=[.E23]/[.D23] -> 1.97142857142857 | G23: 3926 | H23: of:=[.G23]/[.D23] -> 1.62567287784679
C24: NVS | D24: 2768 | E24: 5316 | F24: of:=[.E24]/[.D24] -> 1.92052023121387 | G24: 4371 | H24: of:=[.G24]/[.D24] -> 1.57911849710983
C25: VNS | D25: 2413 | G25: 3764 | H25: of:=[.G25]/[.D25] -> 1.55988396187319
C26: VS | D26: 2662 | G26: 3814 | H26: of:=[.G26]/[.D26] -> 1.43275732531931
B27: A_B_0.8_C_0.2 | C27: NVNS | D27: 2747 | E27: 5377 | F27: of:=[.E27]/[.D27] -> 1.9574080815435 | G27: 4900 | H27: of:=[.G27]/[.D27] -> 1.78376410629778
C28: NVS | D28: 3081 | E28: 5735 | F28: of:=[.E28]/[.D28] -> 1.86140863356053 | G28: 5288 | H28: of:=[.G28]/[.D28] -> 1.7163258682246
C29: VNS | D29: 2692 | G29: 4483 | H29: of:=[.G29]/[.D29] -> 1.66530460624071
C30: VS | D30: 2870 | G30: 4562 | H30: of:=[.G30]/[.D30] -> 1.58954703832753
B31: A_B_0.8_C_0.8 | C31: NVNS | D31: 2943 | E31: 5617 | F31: of:=[.E31]/[.D31] -> 1.90859667006456 | G31: 5309 | H31: of:=[.G31]/[.D31] -> 1.80394155623513
C32: NVS | D32: 3292 | E32: 6151 | F32: of:=[.E32]/[.D32] -> 1.86846901579587 | G32: 5673 | H32: of:=[.G32]/[.D32] -> 1.72326852976914
C33: VNS | D33: 3000 | G33: 4988 | H33: of:=[.G33]/[.D33] -> 1.66266666666667
C34: VS | D34: 3204 | G34: 5047 | H34: of:=[.G34]/[.D34] -> 1.57521847690387